"DESCRIPTION","DURATION IN MS","NAME","PARENT SUITE","START TIME","STATUS","STOP TIME","SUB SUITE","SUITE","TEST CLASS","TEST METHOD"
"","1","maps a null old_price to undefined and a null reason to undefined","PriceHistoryMapper","2026-07-16","passed","2026-07-16","","","",""
"","1","does not advertise overrides for unknown accounts or OLX subcategories","OlxPublicationQuotaService","2026-07-16","passed","2026-07-16","","","",""
"","1","fails closed when evaluating an invalid current time","OlxPublicationQuota","2026-07-16","passed","2026-07-16","","","",""
"","1","auto-applies safe types only","HermesDecisionEngine.determineAutonomy","2026-07-16","passed","2026-07-16","","balanced","",""
"","3","acquires and releases the per-marketplace lock","RedisMarketplaceOAuthRefreshLock","2026-07-16","passed","2026-07-16","","","",""
"","2","enqueues a publish job and logs intent when connected","PublishListingUseCase","2026-07-16","passed","2026-07-16","","","",""
"","1","uses a stacked layout on narrow screens and a row layout from sm up","AnalyticsDateRangeControls","2026-07-16","passed","2026-07-16","","","",""
"","1","rejects invalid form values and removes discarded drafts","product wizard draft persistence","2026-07-16","passed","2026-07-16","","","",""
"","1","gives up after exhausting retries and throws the rate-limit error (updateListing)","OLXAdapter","2026-07-16","passed","2026-07-16","","","",""
"","7","maps /settings to the contextual title Settings","canonical MarketDesk shell contract","2026-07-16","passed","2026-07-16","","","",""
"","1","maps OLX remote status moderation to local status live","OLXAdapter","2026-07-16","passed","2026-07-16","","","",""
"","0","rejects an invalid staleAt date","OlxPublicationQuotaService","2026-07-16","passed","2026-07-16","","","",""
"","2","throws (never claims delivered) on a non-2xx SendGrid response","SendGridHttpTransport (C3 real transport)","2026-07-16","passed","2026-07-16","","","",""
"","2","updates listing price locally and queues remote price update for live listings","ApproveHermesEventUseCase","2026-07-16","passed","2026-07-16","","","",""
"","2","moves human approval through applying to applied","HermesEvent lifecycle transitions","2026-07-16","passed","2026-07-16","","","",""
"","1","maps OLX remote status limited to local status live","OLXAdapter","2026-07-16","passed","2026-07-16","","","",""
"","2","exposes generated events as presented views via the application service","RunHermesUseCase","2026-07-16","passed","2026-07-16","","","",""
"","2","returns NOT_FOUND for an unknown listing","PublishListingUseCase","2026-07-16","passed","2026-07-16","","","",""
"","3","makes non-zero sync errors prominent and actionable","MarketplaceCard","2026-07-16","passed","2026-07-16","","","",""
"","0","rejects an invalid staleAt date","OlxPublicationQuota","2026-07-16","passed","2026-07-16","","","",""
"","2","returns the durable winner when another worker already began publishing","PublishAttemptRepository","2026-07-16","passed","2026-07-16","","","",""
"","7","returns a 404 envelope for unknown /api routes","Presentation API","2026-07-16","passed","2026-07-16","","unmatched routes","",""
"","1","persists a block without consuming quota","OlxPublicationQuotaRepository","2026-07-16","passed","2026-07-16","","","",""
"","31","stores a fully decoded image/jpeg image in the authenticated workspace","ProductImageUploadService","2026-07-16","passed","2026-07-16","","","",""
"","2","refreshes an expired access token and persists refresh-token rotation","MarketplaceOAuthService","2026-07-16","passed","2026-07-16","","","",""
"","5","renews the owned lease before it expires","RedisMarketplaceOAuthRefreshLock","2026-07-16","passed","2026-07-16","","","",""
"","1","adds and subtracts same-currency amounts","Money","2026-07-16","passed","2026-07-16","","","",""
"","0","accepts below-cost creation with explicit confirmation","Product invariants","2026-07-16","passed","2026-07-16","","","",""
"","8","returns 401 when unauthenticated","Presentation API","2026-07-16","passed","2026-07-16","","products","",""
"","3","populates every required AppDeps field","buildContainer (composition root)","2026-07-16","passed","2026-07-16","","","",""
"","5","omits canonical external URLs for draft listings","presentListing","2026-07-16","passed","2026-07-16","","","",""
"","3","round-trips OAuth credentials without storing plaintext","AesGcmCredentialVault","2026-07-16","passed","2026-07-16","","","",""
"","2","rejects blank CORS_ORIGIN in production","createCorsOptions","2026-07-16","passed","2026-07-16","","","",""
"","11","falls back to existing product images for photo-first AI draft requests","Presentation API","2026-07-16","passed","2026-07-16","","products","",""
"","1","shows only pending Hermes recommendations for the current product","ListingDetailsPage presentation","2026-07-16","passed","2026-07-16","","","",""
"","9","returns 422 when approving a non-pending event","Presentation API","2026-07-16","passed","2026-07-16","","hermes","",""
"","2","keeps date inputs controlled and forwards updates","AnalyticsDateRangeControls","2026-07-16","passed","2026-07-16","","","",""
"","4","uses the marketplace account access token for real OLX update jobs","PublishListingHandler","2026-07-16","passed","2026-07-16","","","",""
"","2","unschedules by deterministic marketplace job id","MarketplaceSyncScheduler","2026-07-16","passed","2026-07-16","","","",""
"","10","rejects a message without a recipient","EmailProvider","2026-07-16","passed","2026-07-16","","","",""
"","1","keeps pending and not-yet-synced provider states internally consistent","ListingDetailsPage presentation","2026-07-16","passed","2026-07-16","","","",""
"","3","routes non-safe types to review","HermesDecisionEngine.determineAutonomy","2026-07-16","passed","2026-07-16","","balanced","",""
"","4","filters product recommendations before pagination","HermesApplicationService.listEvents","2026-07-16","passed","2026-07-16","","","",""
"","2","records applying failures as terminal failed events","HermesEvent lifecycle transitions","2026-07-16","passed","2026-07-16","","","",""
"","1","keeps suggestions pending under suggest_only","HermesDecisionEngine.run","2026-07-16","passed","2026-07-16","","","",""
"","18","maps concurrent duplicate listing persistence to a conflict response","Presentation API","2026-07-16","passed","2026-07-16","","products","",""
"","4","locks the operation and quota row before atomically consuming a free unit","OlxPublicationQuotaRepository","2026-07-16","passed","2026-07-16","","","",""
"","1","compares amounts and reports equality","Money","2026-07-16","passed","2026-07-16","","","",""
"","1","creates the vinted adapter with a matching key","MarketplaceAdapterFactory","2026-07-16","passed","2026-07-16","","","",""
"","2","maps persistence rows without changing the encrypted credential envelope","MarketplaceAccountRepository","2026-07-16","passed","2026-07-16","","","",""
"","2","falls back to the marketplace listing id before showing a generic label","formatListingChartLabel","2026-07-16","passed","2026-07-16","","","",""
"","2","requires at least one photo before leaving Photos","ProductWizardForm required-step validation","2026-07-16","passed","2026-07-16","","","",""
"","2","returns NOT_FOUND when approving an event from another workspace (IDOR, S2)","ApproveHermesEventUseCase","2026-07-16","passed","2026-07-16","","","",""
"","2","maps OLX remote status new to local status live","OLXAdapter","2026-07-16","passed","2026-07-16","","","",""
"","1","targets the workspace-scoped delete endpoint by opaque image id","product image API requests","2026-07-16","passed","2026-07-16","","","",""
"","1","returns null (treats as miss) on corrupt JSON","RedisCache","2026-07-16","passed","2026-07-16","","","",""
"","1","resolves void even though the broker returns an id","EventPublisher (IEventPublisher)","2026-07-16","passed","2026-07-16","","","",""
"","2","does not refresh when workspace app credentials are missing","MarketplaceOAuthService","2026-07-16","passed","2026-07-16","","","",""
"","3","retries checkpointed publish jobs with exponential backoff","buildContainer (composition root)","2026-07-16","passed","2026-07-16","","","",""
"","6","rejects realtime mode until verified provider webhooks exist","MarketplaceSyncScheduler","2026-07-16","passed","2026-07-16","","","",""
"","2","sets and reads operator quota without permitting consumed to decrease in-cycle","OlxPublicationQuotaService","2026-07-16","passed","2026-07-16","","","",""
"","1","validates description length on update","Product price / description updates","2026-07-16","passed","2026-07-16","","","",""
"","1","POSTs to the SendGrid API and returns the message id; reports non-stub","SendGridHttpTransport (C3 real transport)","2026-07-16","passed","2026-07-16","","","",""
"","1","exposes lifecycle handles and a resolving shutdown()","buildContainer (composition root)","2026-07-16","passed","2026-07-16","","","",""
"","3","preserves existing engagement counters when OLX reports a metric as unavailable","SyncMarketplaceHandler","2026-07-16","passed","2026-07-16","","","",""
"","1","maps OLX remote status removed to local status expired","OLXAdapter","2026-07-16","passed","2026-07-16","","","",""
"","1","suggestPrice falls back to current price / low confidence on unparseable output","HermesAI (IAIProvider)","2026-07-16","passed","2026-07-16","","","",""
"","1","treats invalid, negative, and schema-changed OLX counters as unavailable","OLXAdapter","2026-07-16","passed","2026-07-16","","","",""
"","7","maps domain input to the OLX ad payload and returns the external id","OLXAdapter","2026-07-16","passed","2026-07-16","","","",""
"","45","renders a safe external OLX link for live listings","ListingsTable external marketplace link","2026-07-16","passed","2026-07-16","","","",""
"","1","requires a real connected marketplace and an explicit selection","ProductWizardForm required-step validation","2026-07-16","passed","2026-07-16","","","",""
"","1","rejects publishing when the local flag is true but no OAuth account exists","PublishListingUseCase","2026-07-16","passed","2026-07-16","","","",""
"","1","forces review when autoAdjustPricing is disabled, even under full_auto","HermesDecisionEngine guardrails (C1 / AMENDMENT FIX #5)","2026-07-16","passed","2026-07-16","","","",""
"","2","stores a hash of state and consumes the context exactly once","RedisMarketplaceOAuthStateStore","2026-07-16","passed","2026-07-16","","","",""
"","26","relist performs an actual republish (not a no-op) and finalizes live (C6)","E2E product/listing/Hermes flow (in-memory, no DB)","2026-07-16","passed","2026-07-16","","","",""
"","1","throws when the secret is still a your_-prefixed placeholder","resolveJwtSecret (S1 fail-closed JWT secret)","2026-07-16","passed","2026-07-16","","production","",""
"","1","returns the eBay stub adapter whose operations reject as not implemented","MarketplaceAdapterFactory","2026-07-16","passed","2026-07-16","","","",""
"","2","persists an explicit override and consumes the associated quota row","OlxPublicationQuotaRepository","2026-07-16","passed","2026-07-16","","","",""
"","1","returns a clearly-marked dev-only value when unset","resolveJwtSecret (S1 fail-closed JWT secret)","2026-07-16","passed","2026-07-16","","development","",""
"","8","classifies missing configuration as a configuration error","OlxOAuthClient","2026-07-16","passed","2026-07-16","","","",""
"","1","does not let an unlock error replace a successful operation result","RedisMarketplaceOAuthRefreshLock","2026-07-16","passed","2026-07-16","","","",""
"","0","allows zero draft prices and selling price equal to cost","Product invariants","2026-07-16","passed","2026-07-16","","","",""
"","12","returns a 404 error envelope for an unknown event","Presentation API","2026-07-16","passed","2026-07-16","","hermes","",""
"","2","removes app credentials only after clearing account tokens","MarketplaceOAuthService","2026-07-16","passed","2026-07-16","","","",""
"","7","records a marketplace sync error and rethrows when the adapter fails (C5)","SyncMarketplaceHandler","2026-07-16","passed","2026-07-16","","","",""
"","1","creates a valid price event as pending_review by default","HermesEvent creation invariants","2026-07-16","passed","2026-07-16","","","",""
"","2","refuses to publish to a disconnected marketplace","Listing publish rules","2026-07-16","passed","2026-07-16","","","",""
"","0","rejects a description shorter than 20 chars","Product invariants","2026-07-16","passed","2026-07-16","","","",""
"","1","does not expose provider bodies or client secrets in token errors","OlxOAuthClient","2026-07-16","passed","2026-07-16","","","",""
"","2","deletes only through the authenticated workspace scope","ProductImageUploadService","2026-07-16","passed","2026-07-16","","","",""
"","1","treats invalid OLX counter value decimal string as unavailable","OLXAdapter","2026-07-16","passed","2026-07-16","","","",""
"","2","keeps non-OLX sync on the existing generic adapter path","SyncMarketplaceHandler","2026-07-16","passed","2026-07-16","","","",""
"","1","maps /hermes to the contextual title Hermes AI","canonical MarketDesk shell contract","2026-07-16","passed","2026-07-16","","","",""
"","8","deletes through the authenticated workspace and reports missing images","product image upload HTTP contract","2026-07-16","passed","2026-07-16","","","",""
"","8","rejects a stale update snapshot instead of overwriting newer product data","PublishListingHandler","2026-07-16","passed","2026-07-16","","","",""
"","2","centers the full-size preview without stretching it across both axes","ListingDetailsPage presentation","2026-07-16","passed","2026-07-16","","","",""
"","1","applies simultaneous cost and selling price increases without transient invariant failure","UpdateProductUseCase","2026-07-16","passed","2026-07-16","","","",""
"","2","serializes different publish operation ids for the same listing","PublishListingHandler","2026-07-16","passed","2026-07-16","","","",""
"","2","re-publishes an explicitly requested relist even when the listing is currently live","PublishListingHandler","2026-07-16","passed","2026-07-16","","","",""
"","4","deletes only an image in the requested workspace","FilesystemProductImageStorage","2026-07-16","passed","2026-07-16","","","",""
"","1","works without an event publisher","PublishListingHandler","2026-07-16","passed","2026-07-16","","","",""
"","1","treats invalid OLX counter value negative number as unavailable","OLXAdapter","2026-07-16","passed","2026-07-16","","","",""
"","1","treats invalid OLX counter value decimal number as unavailable","OLXAdapter","2026-07-16","passed","2026-07-16","","","",""
"","2","passes remote status and hosted images from publish results to the finalizer","PublishListingHandler","2026-07-16","passed","2026-07-16","","","",""
"","16","runs Hermes for the workspace (endpoint returns 202)","E2E product/listing/Hermes flow (in-memory, no DB)","2026-07-16","passed","2026-07-16","","","",""
"","11","uses readable labels in the chart data transformation and preserves top-view sorting","buildViewsChartData","2026-07-16","passed","2026-07-16","","","",""
"","2","builds an authorization URL with state and the registered redirect URI","OlxOAuthClient","2026-07-16","passed","2026-07-16","","","",""
"","21","fails during container construction for an invalid credential-vault key","buildContainer (composition root)","2026-07-16","passed","2026-07-16","","","",""
"","1","maps /analytics to the contextual title Analytics","canonical MarketDesk shell contract","2026-07-16","passed","2026-07-16","","","",""
"","2","sends the complete OLX advert payload when updating one field","OLXAdapter","2026-07-16","passed","2026-07-16","","","",""
"","1","forbids reverse transitions (active -> draft)","Product status transitions (forward-only)","2026-07-16","passed","2026-07-16","","","",""
"","3","rejects callback when OLX app credentials rotated after authorization started","MarketplaceOAuthService","2026-07-16","passed","2026-07-16","","","",""
"","1","isolates quota reads by workspace and account","OlxPublicationQuotaService","2026-07-16","passed","2026-07-16","","","",""
"","2","upserts by marketplace_id so a marketplace has one active OAuth account","MarketplaceAccountRepository","2026-07-16","passed","2026-07-16","","","",""
"","1","treats invalid OLX counter value empty string as unavailable","OLXAdapter","2026-07-16","passed","2026-07-16","","","",""
"","1","suggestPrice tolerates JSON wrapped in a fenced code block","HermesAI (IAIProvider)","2026-07-16","passed","2026-07-16","","","",""
"","4","on retry with an already-published listing, finalizes WITHOUT calling adapter.publish again (CR2/CR3)","PublishListingHandler","2026-07-16","passed","2026-07-16","","","",""
"","1","maps a price event with typed proposed change","EventMapper","2026-07-16","passed","2026-07-16","","","",""
"","2","rejects unsupported and oversized image data through distinct validation paths","ProductImageUploadService","2026-07-16","passed","2026-07-16","","","",""
"","1","rejects blank photo values and more than twelve photos","ProductWizardForm required-step validation","2026-07-16","passed","2026-07-16","","","",""
"","72","GET /products/:idB -> 404","IDOR: workspace A cannot reach workspace B resources (S2)","2026-07-16","passed","2026-07-16","","","",""
"","2","rejects completing an undo as applied","HermesEvent lifecycle transitions","2026-07-16","passed","2026-07-16","","","",""
"","1","enqueues with marketplaceId when the OAuth account is connected","PublishListingUseCase","2026-07-16","passed","2026-07-16","","","",""
