"DESCRIPTION","DURATION IN MS","NAME","PARENT SUITE","START TIME","STATUS","STOP TIME","SUB SUITE","SUITE","TEST CLASS","TEST METHOD"
"","7","releases the lock when the protected operation fails","RedisMarketplaceOAuthRefreshLock","2026-07-16","passed","2026-07-16","","","",""
"","1","maps supported OLX engagement counters and parses numeric strings safely","OLXAdapter","2026-07-16","passed","2026-07-16","","","",""
"","1","refuses cross-currency arithmetic","Money","2026-07-16","passed","2026-07-16","","","",""
"","6","fails fast for an invalid configured file-size limit","ProductImageUploadService","2026-07-16","passed","2026-07-16","","","",""
"","3","does not retry permanent finalization failures","PublishListingHandler","2026-07-16","passed","2026-07-16","","","",""
"","2","enables a local connection only after a matching authoritative check","ProductWizardForm authoritative marketplace readiness","2026-07-16","passed","2026-07-16","","","",""
"","1","passesGuardrails honours per-action master switches","HermesDecisionEngine guardrails (C1 / AMENDMENT FIX #5)","2026-07-16","passed","2026-07-16","","","",""
"","70","delivers nothing to a client with no bound workspace — fail closed (CR5)","HermesLiveUpdates","2026-07-16","passed","2026-07-16","","","",""
"","1","allows unrelated edits to an existing confirmed below-cost product","UpdateProductUseCase","2026-07-16","passed","2026-07-16","","","",""
"","2","rejects a duplicate SKU with a conflict","CreateProductUseCase","2026-07-16","passed","2026-07-16","","","",""
"","2","queues marketplace updates for approved title changes on live listings","ApproveHermesEventUseCase","2026-07-16","passed","2026-07-16","","","",""
"","2","routes unsupported automatic relists to review before execution","HermesDecisionEngine.run","2026-07-16","passed","2026-07-16","","","",""
"","32","requires workspace OLX application credentials before starting OAuth","MarketplaceOAuthService","2026-07-16","passed","2026-07-16","","","",""
"","1","maps OLX statistics-shaped engagement counters from live advert sync responses","OLXAdapter","2026-07-16","passed","2026-07-16","","","",""
"","1","maps OLX remote status rejected to local status error","OLXAdapter","2026-07-16","passed","2026-07-16","","","",""
"","2","moves active styling when Notifications becomes the selected section","SettingsPage shell navigation","2026-07-16","passed","2026-07-16","","","",""
"","9","rejects invalid configured value abc","positiveInt","2026-07-16","passed","2026-07-16","","","",""
"","3","coalesces delayed operations enqueued from the same listing generation","PublishListingHandler","2026-07-16","passed","2026-07-16","","","",""
"","2","preserves blank imported cost prices through edit submission","productFormModel below-cost pricing","2026-07-16","passed","2026-07-16","","","",""
"","2","returns null when fetching a missing OLX advert","OLXAdapter","2026-07-16","passed","2026-07-16","","","",""
"","11","GET /workspaces/:idB returns the caller OWN workspace (A)","IDOR: workspace A cannot reach workspace B resources (S2)","2026-07-16","passed","2026-07-16","","","",""
"","2","updates refreshed credentials with a connected-state compare-and-swap","MarketplaceAccountRepository","2026-07-16","passed","2026-07-16","","","",""
"","1","moves automatic decisions through applying","HermesEvent lifecycle transitions","2026-07-16","passed","2026-07-16","","","",""
"","34","PATCH /products/:idB -> 404 (no mutation)","IDOR: workspace A cannot reach workspace B resources (S2)","2026-07-16","passed","2026-07-16","","","",""
"","2","blocks stale quota without an override","OlxPublicationQuotaService","2026-07-16","passed","2026-07-16","","","",""
"","16","reads and validates authenticated OLX quota operator contracts","Presentation API","2026-07-16","passed","2026-07-16","","marketplace OAuth","",""
"","1","maps columns, coerces DECIMAL strings to numbers and ISO-serializes the date","PriceHistoryMapper","2026-07-16","passed","2026-07-16","","","",""
"","52","retries a transient checkpoint write without repeating provider publish","PublishListingHandler","2026-07-16","passed","2026-07-16","","","",""
"","1","stubs quietly when no email credentials are configured","createEmailProvider factory (C3)","2026-07-16","passed","2026-07-16","","","",""
"","2","updates cost price while preserving currency","Product price / description updates","2026-07-16","passed","2026-07-16","","","",""
"","1","requires an external listing id","Listing publish rules","2026-07-16","passed","2026-07-16","","","",""
"","2","allows exact configured origins","createCorsOptions","2026-07-16","passed","2026-07-16","","","",""
"","38","publishes a listing and finalizes it live in the store (handler fix)","E2E product/listing/Hermes flow (in-memory, no DB)","2026-07-16","passed","2026-07-16","","","",""
"","1","allows a null change for informational photo suggestions","HermesEvent creation invariants","2026-07-16","passed","2026-07-16","","","",""
"","2","expires a live listing and relists it","Listing lifecycle","2026-07-16","passed","2026-07-16","","","",""
"","3","resolves current marketplace listing ids when a scheduled sync job has an empty payload","SyncMarketplaceHandler","2026-07-16","passed","2026-07-16","","","",""
"","1","computes fractional change (a 20% drop)","Money","2026-07-16","passed","2026-07-16","","","",""
"","4","runs the engine and persists generated events","RunHermesUseCase","2026-07-16","passed","2026-07-16","","","",""
"","94","logs in and returns the current principal via /auth/me","E2E product/listing/Hermes flow (in-memory, no DB)","2026-07-16","passed","2026-07-16","","","",""
"","1","uses the first safe OLX URL candidate when earlier candidates are invalid","OLXAdapter","2026-07-16","passed","2026-07-16","","","",""
"","5","stores a fully decoded image/webp image in the authenticated workspace","ProductImageUploadService","2026-07-16","passed","2026-07-16","","","",""
"","2","returns an empty price history for an unknown listing","AuthUserRepository / PriceHistoryRepository (integration)","2026-07-16","passed","2026-07-16","","","",""
"","7","marks General as the default active section and exposes section captions","SettingsPage shell navigation","2026-07-16","passed","2026-07-16","","","",""
"","1","is true for critical competitor price detections","HermesEvent requiresHumanReview","2026-07-16","passed","2026-07-16","","","",""
"","9","dismisses a pending event without requiring an explicit JSON body","Presentation API","2026-07-16","passed","2026-07-16","","hermes","",""
"","3","reorders photos and promotes a selected cover without mutating input","ProductImageUploader helpers","2026-07-16","passed","2026-07-16","","","",""
"","1","generateTitle returns a cleaned single-line title and includes marketplace context","HermesAI (IAIProvider)","2026-07-16","passed","2026-07-16","","","",""
"","2","throws a clear error when the Hermes request times out","HermesCompletionClient","2026-07-16","passed","2026-07-16","","","",""
"","25","requires explicit API confirmation before creating below-cost pricing","Presentation API","2026-07-16","passed","2026-07-16","","products","",""
"","11","returns app-authoritative OLX account status from the protected check endpoint","Presentation API","2026-07-16","passed","2026-07-16","","marketplace OAuth","",""
"","4","documents manual mode as explicit-action only and removes schedules","MarketplaceSyncScheduler","2026-07-16","passed","2026-07-16","","","",""
"","2","returns null on a miss","RedisCache","2026-07-16","passed","2026-07-16","","","",""
"","2","creates from a major-unit decimal and exposes minor units","Money","2026-07-16","passed","2026-07-16","","","",""
"","2","serializes disconnect behind an in-flight refresh so credentials stay cleared","MarketplaceOAuthService","2026-07-16","passed","2026-07-16","","","",""
"","2","creates and reads back a user (workspace-less)","AuthUserRepository / PriceHistoryRepository (integration)","2026-07-16","passed","2026-07-16","","","",""
"","6","returns a real, non-placeholder secret unchanged","resolveJwtSecret (S1 fail-closed JWT secret)","2026-07-16","passed","2026-07-16","","production","",""
"","1","releases the listing-level active guard after finalization","PublishAttemptRepository","2026-07-16","passed","2026-07-16","","","",""
"","2","returns canonical HTTPS OLX external URLs","presentListing","2026-07-16","passed","2026-07-16","","","",""
"","1","works against its default stub transport with no injected client","OLXAdapter","2026-07-16","passed","2026-07-16","","","",""
"","11","GET /marketplaces/:idB -> 404","IDOR: workspace A cannot reach workspace B resources (S2)","2026-07-16","passed","2026-07-16","","","",""
"","1","enriches workspace listing rows with product title and SKU","ListingApplicationService","2026-07-16","passed","2026-07-16","","","",""
"","3","rejects truncated and magic-prefix-only payloads","ProductImageUploadService","2026-07-16","passed","2026-07-16","","","",""
"","1","normalizes 401 to MarketplaceAuthenticationError","OLXAdapter","2026-07-16","passed","2026-07-16","","","",""
"","17","returns a VALIDATION_ERROR envelope with field details on invalid create","Presentation API","2026-07-16","passed","2026-07-16","","products","",""
"","1","applies simultaneous price decreases when selling drops below the old cost","UpdateProductUseCase","2026-07-16","passed","2026-07-16","","","",""
"","1","analyzeListing clamps the score and returns string suggestions","HermesAI (IAIProvider)","2026-07-16","passed","2026-07-16","","","",""
"","104","retries transient token and finalization work without repeating publish","PublishListingHandler","2026-07-16","passed","2026-07-16","","","",""
"","2","returns a structured guard error when the OLX quota guard is unavailable","ApproveHermesEventUseCase","2026-07-16","passed","2026-07-16","","","",""
"","16","starts OLX OAuth without marking the marketplace connected","MarketplaceOAuthService","2026-07-16","passed","2026-07-16","","","",""
"","12","GET /products/:idB/listings -> 404","IDOR: workspace A cannot reach workspace B resources (S2)","2026-07-16","passed","2026-07-16","","","",""
"","1","formats and stringifies","Money","2026-07-16","passed","2026-07-16","","","",""
"","1","rejects an invalid cycleStartedAt date","OlxPublicationQuotaService","2026-07-16","passed","2026-07-16","","","",""
"","37","does not render the external link for draft listings","ListingsTable external marketplace link","2026-07-16","passed","2026-07-16","","","",""
"","2","warns and marks zero-price submissions when cost is positive","productFormModel below-cost pricing","2026-07-16","passed","2026-07-16","","","",""
"","1","does not require confirmation at or above the cost boundary","productFormModel below-cost pricing","2026-07-16","passed","2026-07-16","","","",""
"","1","auto-applies normal suggestions","HermesDecisionEngine.determineAutonomy","2026-07-16","passed","2026-07-16","","full_auto","",""
"","153","resumes finalization from a durable checkpoint without re-publishing","PublishListingHandler","2026-07-16","passed","2026-07-16","","","",""
"","118","rejects an unknown email with the same 401 envelope (S6 constant-time path)","Presentation API","2026-07-16","passed","2026-07-16","","auth","",""
"","1","explains the provider status without repeating an unlabeled Active value","ListingDetailsPage presentation","2026-07-16","passed","2026-07-16","","","",""
"","1","maps OLX remote status deactivated to local status expired","OLXAdapter","2026-07-16","passed","2026-07-16","","","",""
"","2","returns a configured positive integer or the fallback","positiveInt","2026-07-16","passed","2026-07-16","","","",""
"","2","rejects invalid configured value 1.5","positiveInt","2026-07-16","passed","2026-07-16","","","",""
"","2","does not enqueue a relist when the OAuth account is disconnected","ApproveHermesEventUseCase","2026-07-16","passed","2026-07-16","","","",""
"","7","starts OLX OAuth from an authenticated workspace without marking local success","Presentation API","2026-07-16","passed","2026-07-16","","marketplace OAuth","",""
"","2","throws when a successful Hermes response is not JSON","HermesCompletionClient","2026-07-16","passed","2026-07-16","","","",""
"","1","maps OLX remote status blocked to local status error","OLXAdapter","2026-07-16","passed","2026-07-16","","","",""
"","7","uses a monotonic upsert so an in-cycle operator update cannot restore consumed units","OlxPublicationQuotaRepository","2026-07-16","passed","2026-07-16","","","",""
"","15","creates a product and returns 201 with the success envelope","Presentation API","2026-07-16","passed","2026-07-16","","products","",""
"","25","accepts an authed connection and binds its workspace from the token (CR4)","HermesLiveUpdates","2026-07-16","passed","2026-07-16","","","",""
"","4","consumes state once, persists encrypted tokens, then marks OLX connected","MarketplaceOAuthService","2026-07-16","passed","2026-07-16","","","",""
"","3","rejects a connection with an invalid token (CR4)","HermesLiveUpdates","2026-07-16","passed","2026-07-16","","","",""
"","1","records an override without consumption when no quota row exists","OlxPublicationQuotaService","2026-07-16","passed","2026-07-16","","","",""
"","7","uses readable product metadata instead of the internal UUID as primary chart label","formatListingChartLabel","2026-07-16","passed","2026-07-16","","","",""
"","2","creates the olx adapter with a matching key","MarketplaceAdapterFactory","2026-07-16","passed","2026-07-16","","","",""
"","1","fails closed for identity mismatch, check failure, and local disconnection","ProductWizardForm authoritative marketplace readiness","2026-07-16","passed","2026-07-16","","","",""
"","1","does not enqueue when the OLX quota decision blocks publication","PublishListingUseCase","2026-07-16","passed","2026-07-16","","","",""
"","2","sends a Hermes session key only when request scope is provided","HermesCompletionClient","2026-07-16","passed","2026-07-16","","","",""
"","1","extracts only opaque uploaded image ids from durable URLs","ProductImageUploader helpers","2026-07-16","passed","2026-07-16","","","",""
"","1","still routes critical competitor price detections to review","HermesDecisionEngine.determineAutonomy","2026-07-16","passed","2026-07-16","","full_auto","",""
"","1","marks below-cost submissions with the documented API flag","productFormModel below-cost pricing","2026-07-16","passed","2026-07-16","","","",""
"","5","creates a valid product with default draft status","Product invariants","2026-07-16","passed","2026-07-16","","","",""
"","2","maps snake_case columns to the AuthUserRecord shape","AuthUserMapper","2026-07-16","passed","2026-07-16","","","",""
"","1","rejects an invalid verifiedAt date","OlxPublicationQuota","2026-07-16","passed","2026-07-16","","","",""
"","3","treats omitted selection as import all and explicit empty selection as import none","MarketplaceImportService","2026-07-16","passed","2026-07-16","","","",""
"","1","persists a cost-price-only update through the repository boundary","UpdateProductUseCase","2026-07-16","passed","2026-07-16","","","",""
"","5","does not PUT an update after a newer listing generation was durably accepted","PublishListingHandler","2026-07-16","passed","2026-07-16","","","",""
"","5","serializes concurrent attempts so only one consumes the final free unit","OlxPublicationQuotaService","2026-07-16","passed","2026-07-16","","","",""
"","2","throws when no chatId is provided or configured","TelegramBot","2026-07-16","passed","2026-07-16","","","",""
"","1","maps workspace columns and defaults guardrails","WorkspaceMapper","2026-07-16","passed","2026-07-16","","","",""
"","1","uses the volatile fallback when no Storage object is available","product wizard draft persistence","2026-07-16","passed","2026-07-16","","","",""
"","3","uploads the original file as a typed raw request body","product image API requests","2026-07-16","passed","2026-07-16","","","",""
"","14","persists failed when an application dependency throws","ApproveHermesEventUseCase","2026-07-16","passed","2026-07-16","","","",""
"","22","writes an opaque image below a hashed workspace directory","FilesystemProductImageStorage","2026-07-16","passed","2026-07-16","","","",""
"","1","rejects invalid terminal-state transitions","HermesEvent lifecycle transitions","2026-07-16","passed","2026-07-16","","","",""
"","1","canPublish is true while not sold","Product status transitions (forward-only)","2026-07-16","passed","2026-07-16","","","",""
"","16","POST /hermes/events/:idB/approve -> 404 (event untouched)","IDOR: workspace A cannot reach workspace B resources (S2)","2026-07-16","passed","2026-07-16","","","",""
"","4","imports eligible selected adverts locally without provider mutations and records provenance","MarketplaceImportService","2026-07-16","passed","2026-07-16","","","",""
"","1","checks a cost-only partial update against the persisted selling price","UpdateProductUseCase","2026-07-16","passed","2026-07-16","","","",""
"","1","persists Hermes events and queries pending review","PostgreSQL repositories (integration)","2026-07-16","passed","2026-07-16","","","",""
"","1","blocks unverified quota without an override","OlxPublicationQuotaService","2026-07-16","passed","2026-07-16","","","",""
"","1","accepts explicit confirmation on below-cost updates","Product price / description updates","2026-07-16","passed","2026-07-16","","","",""
"","2","does not revive sold products from imported live status updates","MarketplaceImportService","2026-07-16","passed","2026-07-16","","","",""
"","2","accepts supported files while enforcing remaining photo capacity","ProductImageUploader helpers","2026-07-16","passed","2026-07-16","","","",""
"","10","returns item-level failed preview entries for unmappable discovered adverts","MarketplaceImportService","2026-07-16","passed","2026-07-16","","","",""
"","8","XADDs the event to the per-aggregate stream with flattened fields","RedisEventBroker","2026-07-16","passed","2026-07-16","","","",""
"","5","detects expiry from a past expiresAt","Listing lifecycle","2026-07-16","passed","2026-07-16","","","",""
"","1","maps OLX remote status active to local status live","OLXAdapter","2026-07-16","passed","2026-07-16","","","",""
"","1","records activity log entries (append-only)","PostgreSQL repositories (integration)","2026-07-16","passed","2026-07-16","","","",""
"","1","maps /marketplaces to the contextual title Marketplaces","canonical MarketDesk shell contract","2026-07-16","passed","2026-07-16","","","",""
"","4","throws a redacted high-level error when Hermes returns an error response","HermesCompletionClient","2026-07-16","passed","2026-07-16","","","",""
"","3","observes transient and unknown remote statuses without destructive transitions","SyncMarketplaceHandler","2026-07-16","passed","2026-07-16","","","",""
"","9","approves a pending event (happy path)","Presentation API","2026-07-16","passed","2026-07-16","","hermes","",""
"","1","finalizes the listing via the injected finalizer and defers the event to it","PublishListingHandler","2026-07-16","passed","2026-07-16","","","",""
"","1","rejects invalid configured value 0","positiveInt","2026-07-16","passed","2026-07-16","","","",""
"","1","prefers the OLX listing when a product is listed on several marketplaces","ListingDetailsPage presentation","2026-07-16","passed","2026-07-16","","","",""
"","5","does NOT retry publish on a 5xx failure (no duplicate POST)","OLXAdapter","2026-07-16","passed","2026-07-16","","","",""
"","3","runs the injected engine and emits a completion event","HermesRunHandler","2026-07-16","passed","2026-07-16","","","",""
"","4","stores a fully decoded image/png image in the authenticated workspace","ProductImageUploadService","2026-07-16","passed","2026-07-16","","","",""
"","1","creates the facebook adapter with a matching key","MarketplaceAdapterFactory","2026-07-16","passed","2026-07-16","","","",""
"","3","invokes navigation updates for another representative section","SettingsPage shell navigation","2026-07-16","passed","2026-07-16","","","",""
"","5","clears existing account tokens when app credentials are rotated","MarketplaceOAuthService","2026-07-16","passed","2026-07-16","","","",""
"","2","blocks exhausted quota without an override","OlxPublicationQuotaService","2026-07-16","passed","2026-07-16","","","",""
"","1","deletes a key","RedisCache","2026-07-16","passed","2026-07-16","","","",""
"","2","normalizes non-2xx responses into HttpError","FetchMarketplaceHttpClient","2026-07-16","passed","2026-07-16","","","",""
"","1","returns a real configured secret unchanged","resolveJwtSecret (S1 fail-closed JWT secret)","2026-07-16","passed","2026-07-16","","development","",""
"","6","records retry-required sync state when a live listing account is disconnected","ApproveHermesEventUseCase","2026-07-16","passed","2026-07-16","","","",""
"","111","provisions a disconnected OLX marketplace pending OAuth on register","Presentation API","2026-07-16","passed","2026-07-16","","auth","",""
"","6","builds an Express app from the resolved deps without throwing","buildContainer (composition root)","2026-07-16","passed","2026-07-16","","","",""
"","2","fails closed and reports an actionable unknown decision when no quota exists","OlxPublicationQuotaService","2026-07-16","passed","2026-07-16","","","",""
"","1","refuses to publish a sold product","Listing publish rules","2026-07-16","passed","2026-07-16","","","",""
"","2","marks only non-empty wizard state as meaningful","product wizard draft persistence","2026-07-16","passed","2026-07-16","","","",""
"","2","blocks live OLX create-listing POST unless explicitly enabled: https://www.olx.pl/api/partner/adverts","FetchMarketplaceHttpClient","2026-07-16","passed","2026-07-16","","","",""
"","0","does not block a no-op navigation","product wizard navigation guard","2026-07-16","passed","2026-07-16","","","",""
"","3","round-trips a typed value with the configured key prefix","RedisCache","2026-07-16","passed","2026-07-16","","","",""
"","3","does not resurrect credentials when the account changes before refresh persistence","MarketplaceOAuthService","2026-07-16","passed","2026-07-16","","","",""
"","1","returns [] for sync with no ids without calling the transport","OLXAdapter","2026-07-16","passed","2026-07-16","","","",""
"","2","does not fall back to a your_-prefixed placeholder","resolveJwtSecret (S1 fail-closed JWT secret)","2026-07-16","passed","2026-07-16","","development","",""
"","2","redacts sensitive provider field-name variants","OLXAdapter","2026-07-16","passed","2026-07-16","","","",""
"","1","reports supported vs unsupported keys","MarketplaceAdapterFactory","2026-07-16","passed","2026-07-16","","","",""
"","3","round-trips a Product aggregate with tags and images","PostgreSQL repositories (integration)","2026-07-16","passed","2026-07-16","","","",""
"","2","exposes a functioning WS event subscriber fed by the broker","buildContainer (composition root)","2026-07-16","passed","2026-07-16","","","",""
"","3","throws (does NOT report success) when finalization fails after a successful publish (CR3)","PublishListingHandler","2026-07-16","passed","2026-07-16","","","",""
"","1","returns NOT_FOUND for an unknown event","ApproveHermesEventUseCase","2026-07-16","passed","2026-07-16","","","",""
"","3","requires a typed price change for price events","HermesEvent creation invariants","2026-07-16","passed","2026-07-16","","","",""
"","2","forbids any transition out of sold","Product status transitions (forward-only)","2026-07-16","passed","2026-07-16","","","",""
"","1","rejects completing a forward application as reverted","HermesEvent lifecycle transitions","2026-07-16","passed","2026-07-16","","","",""
"","2","does not retry already-authorized relists when a later quota decision blocks","ApproveHermesEventUseCase","2026-07-16","passed","2026-07-16","","","",""
"","2","re-reads credentials while holding the refresh lock","MarketplaceOAuthService","2026-07-16","passed","2026-07-16","","","",""
"","1","fails when the workspace is missing","RunHermesUseCase","2026-07-16","passed","2026-07-16","","","",""
"","5","labels sync mode, explains modes, and hides unsupported realtime selection","MarketplaceCard","2026-07-16","passed","2026-07-16","","","",""
"","2","creates one deterministic hourly repeatable job for connected marketplaces","MarketplaceSyncScheduler","2026-07-16","passed","2026-07-16","","","",""
"","14","serializes every canonical lifecycle status without label translation","Presentation API","2026-07-16","passed","2026-07-16","","hermes","",""
"","1","keeps Listings routable but out of primary PRD navigation","canonical MarketDesk shell contract","2026-07-16","passed","2026-07-16","","","",""
"","2","fails validation when the description is too short","CreateProductUseCase","2026-07-16","passed","2026-07-16","","","",""
"","10","requires authentication and an active workspace","product image upload HTTP contract","2026-07-16","passed","2026-07-16","","","",""
"","5","does not remove app credentials when account token clearing fails","MarketplaceOAuthService","2026-07-16","passed","2026-07-16","","","",""
"","3","uses the marketplace account access token for OLX sync jobs","SyncMarketplaceHandler","2026-07-16","passed","2026-07-16","","","",""
"","3","sends through the injected transport, applying the default from address","EmailProvider","2026-07-16","passed","2026-07-16","","","",""
"","0","fails closed when quota evaluation receives an invalid current date","OlxPublicationQuotaService","2026-07-16","passed","2026-07-16","","","",""
"","1","normalizes a null workspace_id","AuthUserMapper","2026-07-16","passed","2026-07-16","","","",""
